name,URL,question,expecteds,must_pass,use_agent,tools,tool_categories,level,nsteps
Femsa,https://enterprise-h2ogpt-public-data.s3.amazonaws.com/Coca-Cola-FEMSA-Results-1Q23-vf-2.pdf,What was the revenue of Brazil?,"[['15,969', 'million']]",False,False,,,,
Femsa,https://enterprise-h2ogpt-public-data.s3.amazonaws.com/Coca-Cola-FEMSA-Results-1Q23-vf-2.pdf,What was the revenue of Mexico?,"[['27,229', 'million']]",False,False,,,,
Femsa,https://enterprise-h2ogpt-public-data.s3.amazonaws.com/Coca-Cola-FEMSA-Results-1Q23-vf-2.pdf,How did gross profit change YoY for South America?,"[['11.0%'], ['11%'],['11.0 %']]",False,False,,,,
Femsa,https://enterprise-h2ogpt-public-data.s3.amazonaws.com/Coca-Cola-FEMSA-Results-1Q23-vf-2.pdf,When was the cybersecurity incident announced?,[['April 26']],True,False,,,,
Femsa,https://enterprise-h2ogpt-public-data.s3.amazonaws.com/Coca-Cola-FEMSA-Results-1Q23-vf-2.pdf,What country had the largest revenue and how much was it?,"[['Mexico', '27,229', 'million']]",False,False,,,,
WellsFargo,https://enterprise-h2ogpt-public-data.s3.amazonaws.com/wellsfargo-2022-annual-report.pdf,What was goodwill balance?,"[['$25.2', 'billion'], ['$25.173', 'billion'], ['$25,173', 'million']]",True,False,,,,
WellsFargo,https://enterprise-h2ogpt-public-data.s3.amazonaws.com/wellsfargo-2022-annual-report.pdf,What was the available borrowing capacity?,"[['$209.0', 'billion'], ['$209', 'billion']]",False,False,,,,
WellsFargo,https://enterprise-h2ogpt-public-data.s3.amazonaws.com/wellsfargo-2022-annual-report.pdf,What was the value of total foreclosed assets in 2022?,"[['$137', 'million']]",False,False,,,,
WellsFargo,https://enterprise-h2ogpt-public-data.s3.amazonaws.com/wellsfargo-2022-annual-report.pdf,How much was the average VaR in 2022?,"[['$35', 'million']]",True,False,,,,
WellsFargo,https://enterprise-h2ogpt-public-data.s3.amazonaws.com/wellsfargo-2022-annual-report.pdf,What was long-term debt at the end of 2022?,"[['$174,870', 'million'], ['$174.870', 'billion'], ['$174.87', 'billion'], ['$174.9', 'billion']]",False,False,,,,
WellsFargo,https://enterprise-h2ogpt-public-data.s3.amazonaws.com/wellsfargo-2022-annual-report.pdf,What was diluted EPS for 2021?,[['$4.95']],False,False,,,,
WellsFargo,https://enterprise-h2ogpt-public-data.s3.amazonaws.com/wellsfargo-2022-annual-report.pdf,What was diluted EPS for 2022?,[['$3.14']],False,False,,,,
WellsFargo,https://enterprise-h2ogpt-public-data.s3.amazonaws.com/wellsfargo-2022-annual-report.pdf,What was total noninterest income for commercial banking?,"[['$3,631', 'million']]",False,False,,,,
WellsFargo,https://enterprise-h2ogpt-public-data.s3.amazonaws.com/wellsfargo-2022-annual-report.pdf,What was total noninterest income for corporate and investment banking?,"[['$6,509', 'million']]",False,False,,,,
WellsFargo,https://enterprise-h2ogpt-public-data.s3.amazonaws.com/wellsfargo-2022-annual-report.pdf,What were total nonperforming assets?,"[['$5,763', 'million'], ['$5.8', 'billion'], ['$5.763', 'billion']]",False,False,,,,
CitiAnnual,https://enterprise-h2ogpt-public-data.s3.amazonaws.com/citi-2022-annual-report.pdf,What was net income?,"[['$14,845', 'million'], ['$14.8', 'billion']]",False,False,,,,
CitiAnnual,https://enterprise-h2ogpt-public-data.s3.amazonaws.com/citi-2022-annual-report.pdf,"How many hours were volunteered, and across how many countries?","[['115,000', '84']]",True,False,,,,
CitiAnnual,https://enterprise-h2ogpt-public-data.s3.amazonaws.com/citi-2022-annual-report.pdf,How much did Citi finance for affordable housing in the U.S.?,"[['$6', 'billion']]",False,False,,,,
CitiAnnual,https://enterprise-h2ogpt-public-data.s3.amazonaws.com/citi-2022-annual-report.pdf,What were total liabilities of Citigroup as of Dec 31 2022?,"[['$2,214,838', 'million'], ['$2,416,676', 'million']]",True,False,,,,
CitiAnnual,https://enterprise-h2ogpt-public-data.s3.amazonaws.com/citi-2022-annual-report.pdf,What were total assets of Citigroup as of Dec 31 2022?,"[['2,416,676', 'million']]",False,False,,,,
CitiAnnual,https://enterprise-h2ogpt-public-data.s3.amazonaws.com/citi-2022-annual-report.pdf,On what page are Basel III Revisions?,"[['49'], ['34'], ['52'], ['53']]",False,False,,,,
CitiAnnual,https://enterprise-h2ogpt-public-data.s3.amazonaws.com/citi-2022-annual-report.pdf,How many employees are at Citi?,"[['240,000']]",True,False,,,,
CitiAnnual,https://enterprise-h2ogpt-public-data.s3.amazonaws.com/citi-2022-annual-report.pdf,What was the revenue from legacy franchises,"[['8.5', 'billion'], ['8,472', 'million'], ['8.472', 'billion']]",False,False,,,,
CitiAnnual,https://enterprise-h2ogpt-public-data.s3.amazonaws.com/citi-2022-annual-report.pdf,How large is the new stress capital buffer?,"[['4.0%'],['4.0 %']]",False,False,,,,
CitiAnnual,https://enterprise-h2ogpt-public-data.s3.amazonaws.com/citi-2022-annual-report.pdf,What were total revenues of Citigroup?,"[['$75,338', 'million'], ['$75.338', 'billion'], ['$75.3', 'billion']]",True,False,,,,
Kaiser,https://enterprise-h2ogpt-public-data.s3.amazonaws.com/kp-annual-report-en-2019.pdf,How many employees does kaiser permanente have?,"[['217,000'], ['217K'], ['217k'], ['217000']]",True,False,,,,
Kaiser,https://enterprise-h2ogpt-public-data.s3.amazonaws.com/kp-annual-report-en-2019.pdf,How many lab results were viewed online?,"[['60.6', 'million'], ['60.6M']]",True,False,,,,
Kaiser,https://enterprise-h2ogpt-public-data.s3.amazonaws.com/kp-annual-report-en-2019.pdf,How many members does KP have?,"[['12.2', 'million'], ['12.2M']]",True,False,,,,
Kaiser,https://enterprise-h2ogpt-public-data.s3.amazonaws.com/kp-annual-report-en-2019.pdf,Who's the regional president in Georgia?,[['Jim Simpson']],False,False,,,,
Kaiser,https://enterprise-h2ogpt-public-data.s3.amazonaws.com/kp-annual-report-en-2019.pdf,Who's the CEO?,"[['Greg A. Adams'], ['Greg Adams']]",True,False,,,,
Kaiser,https://enterprise-h2ogpt-public-data.s3.amazonaws.com/kp-annual-report-en-2019.pdf,How many nurses work at Kaiser?,"[['63k'], ['63,000'], ['63', 'thousand'], ['63K'], ['63000']]",True,False,,,,
Kaiser,https://enterprise-h2ogpt-public-data.s3.amazonaws.com/kp-annual-report-en-2019.pdf,How many colorectal cancer screenings happened that year?,"[['2.2', 'million'], ['2.2M']]",False,False,,,,
CBA-Spreads,https://enterprise-h2ogpt-public-data.s3.amazonaws.com/2023-Annual-Report-Spreads.pdf,What is CBA NPAT this year?,"[['$10,188', 'million'], ['$10,164', 'million'], ['$10,164m']]",False,False,,,,
CBA-Spreads,https://enterprise-h2ogpt-public-data.s3.amazonaws.com/2023-Annual-Report-Spreads.pdf,On what page does the five-year financial summary start?,"[['285']]",False,False,,,,
CBA-Spreads,https://enterprise-h2ogpt-public-data.s3.amazonaws.com/2023-Annual-Report-Spreads.pdf,What's the address of CBA in Syndey?,[['11 Harbour Street']],False,False,,,,
CBA-Spreads,https://enterprise-h2ogpt-public-data.s3.amazonaws.com/2023-Annual-Report-Spreads.pdf,What are the top 3 holders of CommBank PERLS XV Capital Notes?,"[['BNP', 'HSBC', 'Citi']]",False,False,,,,
CBA-Spreads,https://enterprise-h2ogpt-public-data.s3.amazonaws.com/2023-Annual-Report-Spreads.pdf,How much net profit did New Zealand contribute in 2023?,"[['1,356', 'million'], ['1,356m']]",True,False,,,,
CBA-Spreads,https://enterprise-h2ogpt-public-data.s3.amazonaws.com/2023-Annual-Report-Spreads.pdf,How much net profit did New Zealand contribute in 2022?,"[['1,265', 'million'], ['1,265m']]",False,False,,,,
CBA-Spreads,https://enterprise-h2ogpt-public-data.s3.amazonaws.com/2023-Annual-Report-Spreads.pdf,How did H2O.ai help CBA?,"[['world-leading talent'], ['AI models across the bank'], ['AI models across the organization'], ['world-leading AI talent']]",True,False,,,,
NYL_All,https://enterprise-h2ogpt-public-data.s3.amazonaws.com/2022-nyl-investment-report.pdf,How much total assets under management?,"[['$710', 'billion']]",False,False,,,,
NYL_All,https://enterprise-h2ogpt-public-data.s3.amazonaws.com/2022-nyl-investment-report.pdf,How many issuers are in the corporate bond portfolio?,"[['3,300'], ['3300']]",True,False,,,,
NYL_All,https://enterprise-h2ogpt-public-data.s3.amazonaws.com/2022-nyl-investment-report.pdf,What was NYLIC's statutory surplus in 2021?,"[['$24.57', 'billion']]",True,False,,,,
NYL_All,https://enterprise-h2ogpt-public-data.s3.amazonaws.com/2022-nyl-investment-report.pdf,What was total surplus (incl. asset valuation reserve)?,[['$30.1 billion']],False,False,,,,
NYL_All,https://enterprise-h2ogpt-public-data.s3.amazonaws.com/2022-nyl-investment-report.pdf,What percentage is in RMBS?,"[['6%'], ['6 percent'],['6 %']]",False,False,,,,
NYL_All,https://enterprise-h2ogpt-public-data.s3.amazonaws.com/2022-nyl-investment-report.pdf,How large was the dividend payout in 2023?,"[['$2', 'billion'], ['$2.0', 'billion'], ['$2.0', 'BILLION'], ['$2.0', 'Billion']]",True,False,,,,
NYL_All,https://enterprise-h2ogpt-public-data.s3.amazonaws.com/2022-nyl-investment-report.pdf,How large was the general account investment portfolio?,"[['$317.13', 'billion'], ['$317', 'billion'], ['$317.1', 'billion']]",True,False,,,,
Bradesco,https://enterprise-h2ogpt-public-data.s3.amazonaws.com/bradesco-2022-integrated-report.pdf,How many clients does Bradesco serve?,"[['77.1 million'], ['77 million']]",False,False,,,,
Bradesco,https://enterprise-h2ogpt-public-data.s3.amazonaws.com/bradesco-2022-integrated-report.pdf,Who is the chairman of the board?,[['Luiz Carlos Trabuco Cappi']],False,False,,,,
Stryker,https://enterprise-h2ogpt-public-data.s3.amazonaws.com/STRYKER_CORPORATION_2018.pdf,How many shares were issued as performance incentive awards in Q4 2018?,[['150']],True,False,,,,
Stryker,https://enterprise-h2ogpt-public-data.s3.amazonaws.com/STRYKER_CORPORATION_2018.pdf,What was gross profit in 2017?,"[['$8,180', 'million'], ['$8.180', 'billion']]",False,False,,,,
Stryker,https://enterprise-h2ogpt-public-data.s3.amazonaws.com/STRYKER_CORPORATION_2018.pdf,What was total current income tax expense in 2017?,"[['$1,007', 'million'], ['$1.007', 'billion']]",False,False,,,,
AudioLabelGenie,https://enterprise-h2ogpt-public-data.s3.amazonaws.com/label-genie-intro-youtube.mp3,What is Label Genie?,"[['zero-shot labeling'], ['Zero-shot Labeling'], ['zero shot labeling'], ['zero-shot labelling'], ['zero shot labelling']]",False,False,,,,
AudioLabelGenie,https://enterprise-h2ogpt-public-data.s3.amazonaws.com/label-genie-intro-youtube.mp3,Does label genie support audio classification?,"[['Yes'], ['supports audio classification'], ['does support audio classification']]",True,False,,,,
Itau,https://enterprise-h2ogpt-public-data.s3.amazonaws.com/Itau_Economic_Prospects_Report-Sep2023.pdf,What is the Outlook for Eurozone GDP for 2024?,"[['0.7%'],['0.7 %']]",True,False,,,,
Itau,https://enterprise-h2ogpt-public-data.s3.amazonaws.com/Itau_Economic_Prospects_Report-Sep2023.pdf,What is the Outlook for China GDP for 2023?,"[['4.9%'],['4.9 %']]",True,False,,,,
Itau,https://enterprise-h2ogpt-public-data.s3.amazonaws.com/Itau_Economic_Prospects_Report-Sep2023.pdf,What is the Outlook for China GDP for 2024?,"[['4.1%'],['4.1 %']]",False,False,,,,
DAIInstall,https://s3.amazonaws.com/artifacts.h2o.ai/releases/ai/h2o/dai/rel-1.10.6-17/docs/userguide/install/ubuntu.html,Do I need to install CUDA or does Driverless AI ships with CUDA?,"[['Driverless AI ships with CUDA'],['Docker image already includes CUDA'],['Driverless AI includes CUDA']]",True,False,,,,
DAIInstall,https://s3.amazonaws.com/artifacts.h2o.ai/releases/ai/h2o/dai/rel-1.10.6-17/docs/userguide/install/ubuntu.html,What's the minimum memory requirements?,"[['64', 'GB']]",True,False,,,,
DAIInstall,https://s3.amazonaws.com/artifacts.h2o.ai/releases/ai/h2o/dai/rel-1.10.6-17/docs/userguide/install/ubuntu.html,How do I start Driverless AI in Docker? Please include the docker run command.,"[['docker run', '--pid=host', '--rm', '--shm-size=2g']]",False,False,,,,
FastFood,https://enterprise-h2ogpt-public-data.s3.amazonaws.com/fastfood.jpg,What are the top 3 fast-food restaurants across all age cohorts?,"[[""MCDONALD'S"", 'CHICK-FIL-A', 'TACO BELL'], [""McDonald's"", 'Chick-fil-A', 'Taco Bell'],[""McDonald’s"", 'Chick‑fil‑A', 'Taco Bell']]",False,False,,,,
FastFood,https://enterprise-h2ogpt-public-data.s3.amazonaws.com/fastfood.jpg,What is the total number of Wendy's customers?,"[['4,527,294'], ['4527294']]",False,False,,,,
FastFood,https://enterprise-h2ogpt-public-data.s3.amazonaws.com/fastfood.jpg,How many baby boomer customers for Subway are there?,"[['528,785'], ['528785']]",False,False,,,,
FastFood,https://enterprise-h2ogpt-public-data.s3.amazonaws.com/fastfood.jpg,Between which years is a Gen Xer?,"[['1965-1981'], ['1965 to 1981'], ['1965 and 1981']]",False,False,,,,
FastFood,https://enterprise-h2ogpt-public-data.s3.amazonaws.com/fastfood.jpg,Total customers Gen X?,"[['13,192,015'], ['13192015']]",False,False,,,,
FastFood,https://enterprise-h2ogpt-public-data.s3.amazonaws.com/fastfood.jpg,Number of Silent Gen customers for Chipotle?,"[['16,263'], ['16263']]",False,False,,,,
FastFood,https://enterprise-h2ogpt-public-data.s3.amazonaws.com/fastfood.jpg,Total number of customers for Gen X and Gen Z combined?,"[['24,038,048'], ['24038048']]",False,False,,,,
DemoDataJon,https://enterprise-h2ogpt-public-data.s3.amazonaws.com/demo_data_jon.zip,What datasets are used in the paper?,"[['LibriSpeech','VoxPopuli']]",True,False,,,,
AXA-Sigorta,https://enterprise-h2ogpt-public-data.s3.amazonaws.com/AXA-Sigorta-2022-Annual-Report.pdf,Who are the board members?,"[['Christophe Knaub', 'Yavuz Ölken', 'Guillaume Herve Marie Xavier Lejeune', 'Xavier Veyry', 'Maria Jesus De Arteaga Larru', 'Nuria Fernandez Paris', 'Onur Koçkar'], ['Christophe Stephane Knaub', 'Yavuz Ölken', 'Guillaume Herve Marie Xavier Lejeune', 'Xavier Veyry', 'Maria Jesus De Arteaga Larru', 'Nuria Fernandez Paris', 'Onur Koçkar'], ['Christophe Knaub', 'Yavuz Ölken', 'Guillaume Herve Marie Xavier Lejeune', 'Xavier Veyry', 'Maria Jesus de Arteaga Larru', 'Nuria Fernandez Paris', 'Onur Koçkar'], ['Christophe Stephane Knaub', 'Yavuz Ölken', 'Guillaume Herve Marie Xavier Lejeune', 'Xavier Veyry', 'Maria Jesus de Arteaga Larru', 'Nuria Fernandez Paris', 'Onur Koçkar'], ['Christophe Knaub', 'Yavuz Ölken', 'Guillaume Herve Marie Xavier Lejeune', 'Xavier Veyry', 'Maria Jesus de Artega Larru', 'Nuria Fernandez Paris', 'Onur Koçkar'], ['Christophe Stephane Knaub', 'Yavuz Ölken', 'Guillaume Herve Marie Xavier Lejeune', 'Xavier Veyry', 'Maria Jesus de Artega Larru', 'Nuria Fernandez Paris', 'Onur Koçkar']]",False,False,,,,
AXA-Sigorta,https://enterprise-h2ogpt-public-data.s3.amazonaws.com/AXA-Sigorta-2022-Annual-Report.pdf,Compare Axa sigorta's paid claims from 2022 to 2018.,"[['4,852,940', '2,014,216', 'thousands of TL'], ['4,852,940', '2,014,216', 'thousand TL'], ['4,852,940 thousand TL', '2,014,216 thousand TL'], ['4.852.940 (in thousand of TL)', '2.014.216 (in thousands of TL)'], ['4.852.940 (in thousand TL)', '2.014.216 (in thousand TL)'], ['4.852.940 thousand TL', '2.014.216 thousand TL'], ['4,852,940 TL', '2,014,216 TL', 'in thousands of Turkish Lira'], ['4.852.940', '2.014.216', '1,000 TL'], ['4,852,940', '2,014,216', '1,000 TL'], ['4.852.940 TL', '2.014.216 TL', 'in thousands of Turkish Lira'], ['4,852,940,000', '2,014,216,000'], ['4.852.940.000', '2.014.216.000'], ['4.85 billion TL', '2.01 billion TL'],['4 852 940', '2 014 216', 'thousands of Turkish Lira'],['4 852 940', '2 014 216', '(000 TL)'],['4 852 940', '2 014 216', 'thousand TL']]",False,False,,,,
esma,https://enterprise-h2ogpt-public-data.s3.amazonaws.com/2016-1452_guidelines_mifid_ii_transaction_reporting.pdf,When should 'PNDG' be used in the price field?,"[['not available', 'pending']]",False,False,,,,
transxls,https://enterprise-h2ogpt-public-data.s3.amazonaws.com/esma65-8-2594_annex_1_mifir_transaction_reporting_validation_rules.xlsx,What does rule ID 011 say is the Validation Rule?,"[['mandatory for all new transaction reports']]",False,False,,,,
TD-Bank,https://enterprise-h2ogpt-public-data.s3.amazonaws.com/2023-td-bank-reports.tar.bz2,What were Total Liabilities at the end of First Quarter 2023?,"[['1,816', 'billion'], ['1,816,440', 'million']]",False,False,,,,
TD-Bank,https://enterprise-h2ogpt-public-data.s3.amazonaws.com/2023-td-bank-reports.tar.bz2,How many branches does TD Bank have in Canada?,"[['1,060'], ['1060']]",False,False,,,,
TD-Bank,https://enterprise-h2ogpt-public-data.s3.amazonaws.com/2023-td-bank-reports.tar.bz2,How many Active U.S. banking mobile users does TD Bank have?,"[['4.8MM'], ['4.8 million']]",False,False,,,,
adyen,https://enterprise-h2ogpt-public-data.s3.amazonaws.com/Adyen-Annual-Report-2021.pdf,How many books did the Adyen team donate to children in-need in San Francisco?,[['60']],False,False,,,,
best-buy,https://enterprise-h2ogpt-public-data.s3.amazonaws.com/Best-Buy-Investor-Event-March-2022.pdf,Who is the CEO?,[['Corie Barry']],False,False,,,,
best-buy,https://enterprise-h2ogpt-public-data.s3.amazonaws.com/Best-Buy-Investor-Event-March-2022.pdf,How much of the population lives within 10 miles of a Best Buy?,"[['70'], ['70%'], ['70 percent']]",True,False,,,,
best-buy,https://enterprise-h2ogpt-public-data.s3.amazonaws.com/Best-Buy-Investor-Event-March-2022.pdf,How many totaltech members are there?,"[['4.6 million'], ['4,600,000'],['4.5 million'], ['4,500,000']]",True,False,,,,
chevron2022,https://enterprise-h2ogpt-public-data.s3.amazonaws.com/Chevron-2022-Annual-Report.pdf,What was the net income for 2022?,"[['35,465 million'], ['35 billion'], ['35.465 billion'], ['35,608 million'], ['35.608 billion']]",False,False,,,,
doordash,https://enterprise-h2ogpt-public-data.s3.amazonaws.com/DASH_Q2-2022-Earnings-Call-Transcript.pdf,How much did DoorDash spend on the gas savings program?,"[['$40 million'], ['40,000,000']]",False,False,,,,
doordash,https://enterprise-h2ogpt-public-data.s3.amazonaws.com/DASH_Q2-2022-Earnings-Call-Transcript.pdf,Who are the main participants on the call?,"[['Andy Hargreaves', 'Prabir Adarkar', 'Tony Xu']]",False,False,,,,
equifax,https://enterprise-h2ogpt-public-data.s3.amazonaws.com/equifax-February%2B2023%2BInvestor%2BRelations%2BPresentation.pdf,What drove spending reductions?,"[['Workforce', 'reduction', 'data center'], ['workforce', 'reduction', 'data center']]",False,False,,,,
equifax,https://enterprise-h2ogpt-public-data.s3.amazonaws.com/equifax-February%2B2023%2BInvestor%2BRelations%2BPresentation.pdf,How many bolt-on acquisitions have been made?,"[['13'], ['Thirteen'], ['thirteen']]",False,False,,,,
ferrari,https://enterprise-h2ogpt-public-data.s3.amazonaws.com/Annual_Report_Ferrari_NV_2022_13.04.2023_Web.pdf,How many employees did the company have at the end of 2022?,"[['4,919'], ['4919']]",False,False,,,,
goodyear,https://enterprise-h2ogpt-public-data.s3.amazonaws.com/qtr4_2022_goodyear_investor_letter.pdf,What was 4th Quarter adjusted net income?,"[['$20 million'], ['20,000,000']]",False,False,,,,
goodyear,https://enterprise-h2ogpt-public-data.s3.amazonaws.com/qtr4_2022_goodyear_investor_letter.pdf,How much higher are raw material costs expected to be?,"[['$300 million'], ['300,000,000']]",False,False,,,,
goodyear,https://enterprise-h2ogpt-public-data.s3.amazonaws.com/qtr4_2022_goodyear_investor_letter.pdf,Who is the new CFO?,"[['Christina Zamarro'],['Christina L. Zamarro']]",False,False,,,,
heineken,https://enterprise-h2ogpt-public-data.s3.amazonaws.com/Heineken-NV-Full-Year-press-release-02_15_2023.pdf,How much was revenue growth?,"[['30.4%'], ['30.4']]",False,False,,,,
heineken,https://enterprise-h2ogpt-public-data.s3.amazonaws.com/Heineken-NV-Full-Year-press-release-02_15_2023.pdf,What's the name of the campaign Heineken launched to tackle gender bias?,[['Cheers to All Fans']],False,False,,,,
heineken,https://enterprise-h2ogpt-public-data.s3.amazonaws.com/Heineken-NV-Full-Year-press-release-02_15_2023.pdf,What is the leading spirit beer?,[['Desperados']],False,False,,,,
intel,https://enterprise-h2ogpt-public-data.s3.amazonaws.com/intel-q4-2022-financial-and-business-report_F.pdf,What was FY22 total revenue?,"[['63.1 billion'], ['63,100 million'], ['63.1B']]",False,False,,,,
intel,https://enterprise-h2ogpt-public-data.s3.amazonaws.com/intel-q4-2022-financial-and-business-report_F.pdf,What was the code name of the 4th gen xeon processors?,[['Sapphire Rapids']],False,False,,,,
intel,https://enterprise-h2ogpt-public-data.s3.amazonaws.com/intel-q4-2022-financial-and-business-report_F.pdf,What's the world record for overclocking?,[['9.008 GHz']],False,False,,,,
jacobs,https://enterprise-h2ogpt-public-data.s3.amazonaws.com/Jacobs-Investor-Presentation-May-June-2023.pdf,What is Jacobs purpose?,"[['connected', 'sustainable', 'world']]",False,False,,,,
jacobs,https://enterprise-h2ogpt-public-data.s3.amazonaws.com/Jacobs-Investor-Presentation-May-June-2023.pdf,What is Jacobs expected capital expenditure in 2023?,"[['125 million'], ['125,000,000'], ['125M']]",False,False,,,,
jacobs,https://enterprise-h2ogpt-public-data.s3.amazonaws.com/Jacobs-Investor-Presentation-May-June-2023.pdf,What was Critical Mission Solutions revenue in 2022?,"[['4.4 billion'], ['4.4B'], ['4,377 million'], ['4.377 billion']]",False,False,,,,
tyson,https://enterprise-h2ogpt-public-data.s3.amazonaws.com/Tyson-Foods-FINAL-2Q23-Investor-Presentation.pdf,What was the primary driver of volume increase?,"[['improved', 'internal', 'production'],['improvement', 'internal', 'production']]",False,False,,,,
tyson,https://enterprise-h2ogpt-public-data.s3.amazonaws.com/Tyson-Foods-FINAL-2Q23-Investor-Presentation.pdf,What was 1H22 net interest expense?,"[['191 million'], ['191,000,000']]",False,False,,,,
lowes,https://enterprise-h2ogpt-public-data.s3.amazonaws.com/lowes-2022ar-full-report-4-6-23-final.pdf,How much was paid in bonuses to frontline associates?,"[['$580+ million'], ['$580+ Million'], ['580 million'], ['580 Million'], ['580+ million'], ['580+ Million'], ['580,000,000'], ['580,000,000+']]",False,False,,,,
lowes,https://enterprise-h2ogpt-public-data.s3.amazonaws.com/lowes-2022ar-full-report-4-6-23-final.pdf,How many stores are in Florida?,[['128']],False,False,,,,
lowes,https://enterprise-h2ogpt-public-data.s3.amazonaws.com/lowes-2022ar-full-report-4-6-23-final.pdf,What was the adjusted operating margin?,"[['13.0%'], ['13%'], ['13 percent'], ['13.04%'], ['13.04 percent'],['13.0 %'],['13.04 %']]",False,False,,,,
mercedes,https://enterprise-h2ogpt-public-data.s3.amazonaws.com/mercedes-benz-annual-report-2022-incl-combined-management-report-mbg-ag.pdf,How many cars did Mercedes-Benz sell in 2022?,"[['2,040,700'], ['2,040,719'], ['2 million']]",False,False,,,,
mercedes,https://enterprise-h2ogpt-public-data.s3.amazonaws.com/mercedes-benz-annual-report-2022-incl-combined-management-report-mbg-ag.pdf,How many electrified vehicles did Mercedes-Benz sell in 2022?,"[['333,500'],['333 500']]",False,False,,,,
mercedes,https://enterprise-h2ogpt-public-data.s3.amazonaws.com/mercedes-benz-annual-report-2022-incl-combined-management-report-mbg-ag.pdf,What was the net profit?,"[['14,809,000,000'], ['14,809 million'], ['14.8 billion'], ['14.809 billion']]",False,False,,,,
netflix,https://enterprise-h2ogpt-public-data.s3.amazonaws.com/FINAL-Q4-22-Shareholder-Letter.pdf,What was the third most popular series ever on Netflix?,[['Wednesday']],False,False,,,,
netflix,https://enterprise-h2ogpt-public-data.s3.amazonaws.com/FINAL-Q4-22-Shareholder-Letter.pdf,What was the most popular film in Norway?,[['Troll']],False,False,,,,
netflix,https://enterprise-h2ogpt-public-data.s3.amazonaws.com/FINAL-Q4-22-Shareholder-Letter.pdf,What was the operating margin in 2022?,"[['18.0%'], ['18%'], ['18 percent'], ['17.8%'],['18.0 %']]",False,False,,,,
oracle,https://enterprise-h2ogpt-public-data.s3.amazonaws.com/oracle-annual-report-2021-22.pdf,Who is the CFO?,[['Makarand Padalkar']],False,False,,,,
oracle,https://enterprise-h2ogpt-public-data.s3.amazonaws.com/oracle-annual-report-2021-22.pdf,What do Oracles revenues comprise of?,"[['License fees', 'Maintenance fees', 'Consulting fees'], ['license fees', 'maintenance fees', 'consulting fees']]",False,False,,,,
oracle,https://enterprise-h2ogpt-public-data.s3.amazonaws.com/oracle-annual-report-2021-22.pdf,What was unconsolidated operating profit margin in 2022?,"[['54%'], ['54 percent'],['54 %']]",False,False,,,,
ofss,https://enterprise-h2ogpt-public-data.s3.amazonaws.com/ofss-annual-report-2022-23.pdf,What is the name of the new suite of componentized and cloud based services that provides banks with highly scalable self-service digital experience capabilities?,"[['Oracle Banking Cloud Services']]",False,False,,,,
chevron2013_10k,https://enterprise-h2ogpt-public-data.s3.amazonaws.com/chevron_2013_10K.pdf,What are the total revenues and other income reported by Chevron in 2013?,"[['228,848 million'], ['228,848,000,000'], ['229 billion'],['228.848 billion']]",False,False,,,,
chevron2014_10k,https://enterprise-h2ogpt-public-data.s3.amazonaws.com/chevron_2014_10K.pdf,What are the total revenues and other income reported by Chevron in 2014?,"[['211,970', 'millions'], ['211,970 million'], ['211,970,000,000'], ['212 billion'],['211.970 billion']]",False,False,,,,
cbc_sample_report,https://enterprise-h2ogpt-public-data.s3.amazonaws.com/CBC-sample-report-with-notes_0.pdf,Is the RBC value normal?,"[['abnormal'], [""isn't normal""], ['not within the normal range'], ['not normal'], ['not within the reference range'], ['falls outside the reference range']]",False,False,,,,
